{
  "exportedAt": "2024-01-15T10:00:00Z",
  "athlete": {
    "bodyweightKg": 82.5,
    "sex": "male"
  },
  "records": [
    {
      "exercise": {
        "name": "Barbell Back Squat",
        "equipment": "barbell",
        "category": "legs"
      },
      "repMaxes": [
        {
          "reps": 1,
          "weight": 180,
          "unit": "kg",
          "date": "2024-01-10",
          "type": "actual",
          "bodyweightKg": 82.5,
          "rpe": 10,
          "notes": "Competition PR"
        },
        {
          "reps": 3,
          "weight": 165,
          "unit": "kg",
          "date": "2024-01-05",
          "type": "actual"
        },
        {
          "reps": 5,
          "weight": 155,
          "unit": "kg",
          "date": "2023-12-20",
          "type": "actual",
          "workoutId": "workout-123"
        }
      ],
      "estimated1RM": {
        "value": 185,
        "unit": "kg",
        "formula": "brzycki",
        "basedOnReps": 3,
        "basedOnWeight": 165,
        "date": "2024-01-05"
      },
      "volumePR": {
        "value": 8500,
        "unit": "kg",
        "date": "2024-01-12",
        "notes": "10x5 at 170kg"
      }
    },
    {
      "exercise": {
        "name": "Bench Press",
        "equipment": "barbell",
        "category": "chest"
      },
      "repMaxes": [
        {
          "reps": 1,
          "weight": 120,
          "unit": "kg",
          "date": "2024-01-08",
          "type": "actual"
        },
        {
          "reps": 5,
          "weight": 100,
          "unit": "kg",
          "date": "2024-01-02",
          "type": "actual"
        }
      ],
      "estimated1RM": {
        "value": 116,
        "unit": "kg",
        "formula": "epley",
        "basedOnReps": 5,
        "basedOnWeight": 100
      }
    },
    {
      "exercise": {
        "name": "Deadlift",
        "equipment": "barbell",
        "category": "back"
      },
      "repMaxes": [
        {
          "reps": 1,
          "weight": 220,
          "unit": "kg",
          "date": "2024-01-12",
          "type": "actual",
          "bodyweightKg": 83,
          "rpe": 9.5
        }
      ]
    },
    {
      "exercise": {
        "name": "Plank",
        "equipment": "bodyweight",
        "category": "core"
      },
      "durationPR": {
        "seconds": 180,
        "date": "2024-01-08"
      }
    },
    {
      "exercise": {
        "name": "Weighted Plank",
        "equipment": "bodyweight",
        "category": "core"
      },
      "durationPR": {
        "seconds": 60,
        "date": "2024-01-10",
        "weight": 20,
        "unit": "kg",
        "notes": "Plate on back"
      }
    }
  ],
  "normalizedScores": {
    "squat": {
      "wilks": 145.2,
      "dots": 148.5
    },
    "bench": {
      "wilks": 98.3,
      "dots": 100.1
    },
    "deadlift": {
      "wilks": 162.7,
      "dots": 166.0
    },
    "total": {
      "wilks": 406.2,
      "dots": 414.6,
      "ipfGl": 420.5
    }
  }
}
